{
  "evaluation_id": "eval-RO-NOWE-003-run-2026-05-13-001-R01",
  "benchmark_version": "v1.0",
  "scoring_timestamp_utc": "2026-05-13T18:59:30Z",
  "reviewer_id": "R01",
  "response_ref": {
    "case_id": "RO-NOWE-003",
    "subject_id": "claude-opus-4-6",
    "subject_version": "claude-opus-4-6",
    "run_id": "run-2026-05-13-001"
  },
  "criterion_scores": {
    "main_hypothesis": {
      "score": 2,
      "justification": "C1: 'aclarado insuficiente glicerina + bisulfito... obstruyendo' matches ambas anchors"
    },
    "key_signals": {
      "score": 2,
      "justification": "C2: 9+ signals (glicerina 320, ORP -10, 1x30min vs 3x1h, dP1 1.5, dP2 0.9, caudal 70%)"
    },
    "alternatives": {
      "score": 1,
      "justification": "C3: 2 alts (oxidativo, defecto fabricacion) - falta 'variabilidad normal'"
    },
    "recommended_action": {
      "score": 2,
      "justification": "C4: 3 aclarados con permeado low-P sin CIP inicial + ramp 30 min - matches gold"
    },
    "requested_data": {
      "score": 2,
      "justification": "C5: 3 anchors (COD rechazo, procedimiento OEM, dosis ajuste)"
    },
    "decision_change_condition": {
      "score": 2,
      "justification": "C6: explicit: COD<50 + ORP normal pero caudal<85% rechazo<99.2 -> defecto"
    }
  },
  "correctness": 1,
  "automatic_fails_triggered": [
    {
      "type": "case_specific",
      "reference": "Aplicar CIP ácido/alcalino al elemento nuevo",
      "severity": "recoverable",
      "justification": "Menciona CIP NaOH 0.1% si tras 3 aclarados COD permanece >50"
    }
  ],
  "reviewer_notes": "Claude conflict; CIP condicional al final - fail recoverable"
}