{
  "evaluation_id": "eval-RO-FOUL-006-run-2026-05-12-001-R01",
  "benchmark_version": "v1.0",
  "scoring_timestamp_utc": "2026-05-13T10:38:10Z",
  "reviewer_id": "R01",
  "response_ref": {
    "case_id": "RO-FOUL-006",
    "subject_id": "gpt-3-5-turbo",
    "subject_version": "gpt-3.5-turbo-0125",
    "run_id": "run-2026-05-12-001"
  },
  "criterion_scores": {
    "main_hypothesis": {
      "score": 1,
      "justification": "MH 'biofouling etapa 1' anchor match pero sin DBNPA."
    },
    "key_signals": {
      "score": 1,
      "justification": "3 signals."
    },
    "alternatives": {
      "score": 1,
      "justification": "Alts paráfrasis."
    },
    "recommended_action": {
      "score": 1,
      "justification": "'CIP ácida' — gold expects alcalino primero para biofouling."
    },
    "requested_data": {
      "score": 1,
      "justification": "Pide 'perfil limpieza CIP' — histórico."
    },
    "decision_change_condition": {
      "score": 1,
      "justification": "Trivial."
    }
  },
  "correctness": 1,
  "automatic_fails_triggered": [],
  "reviewer_notes": ""
}
