{
  "evaluation_id": "eval-RO-OXID-006-run-2026-05-13-001-R01",
  "benchmark_version": "v1.0",
  "scoring_timestamp_utc": "2026-05-13T18:38:53Z",
  "reviewer_id": "R01",
  "response_ref": {
    "case_id": "RO-OXID-006",
    "subject_id": "gpt-5",
    "subject_version": "gpt-5-2025-08-07",
    "run_id": "run-2026-05-13-001"
  },
  "criterion_scores": {
    "main_hypothesis": {
      "score": 2,
      "justification": "Anchor 'oxidación por ingreso ClO2 + clorito desde piscifactoría + neutralización insuficiente' literal."
    },
    "key_signals": {
      "score": 2,
      "justification": "Conecta evidencia."
    },
    "alternatives": {
      "score": 2,
      "justification": "4 alts (MECH bypass, envejecimiento, scaling, biofouling)."
    },
    "recommended_action": {
      "score": 2,
      "justification": "Parar trenes + flush 30 min + aumentar SBS 4→10 mg/L + aumentar temporal — match gold."
    },
    "requested_data": {
      "score": 2,
      "justification": "Pide ClO2 residual amperométrico durante picos ORP — match accepted."
    },
    "decision_change_condition": {
      "score": 2,
      "justification": "Multi: ClO2 <0.01 + clorito no detectable durante caída rechazo → switch."
    }
  },
  "correctness": 1,
  "automatic_fails_triggered": [],
  "reviewer_notes": ""
}