{
  "evaluation_id": "eval-RO-MECH-005-run-2026-05-13-001-R01",
  "benchmark_version": "v1.0",
  "scoring_timestamp_utc": "2026-05-14T09:34:25Z",
  "reviewer_id": "R01",
  "response_ref": {
    "case_id": "RO-MECH-005",
    "subject_id": "gemini-2-5-pro",
    "subject_version": "gemini-2.5-pro",
    "run_id": "run-2026-05-13-001"
  },
  "criterion_scores": {
    "main_hypothesis": {
      "score": 2,
      "justification": "Anchor 'improper installation Vessel 5 + damaged/missing interconnector + missing brine seal first element + feed-to-conc[entrate bypass]' literal — captura ambas hipótesis (Semi-closed)."
    },
    "key_signals": {
      "score": 1,
      "justification": "Signals brief."
    },
    "alternatives": {
      "score": 1,
      "justification": "3 alts brief (telescoping, defect, sole missing brine seal)."
    },
    "recommended_action": {
      "score": 2,
      "justification": "Isolate + depressurize + unload all 12 + inspect interconnector O-rings + install brine seal correctly — match gold."
    },
    "requested_data": {
      "score": 2,
      "justification": "Pide conductivity profile along central permeate tube probe — match accepted."
    },
    "decision_change_condition": {
      "score": 2,
      "justification": "Multi: gradual uniform increase vs sharp step-change → switch."
    }
  },
  "correctness": 1,
  "automatic_fails_triggered": [],
  "reviewer_notes": ""
}