{
  "evaluation_id": "eval-RO-FOUL-009-run-2026-05-12-001-R01",
  "benchmark_version": "v1.0",
  "scoring_timestamp_utc": "2026-05-13T10:38:10Z",
  "reviewer_id": "R01",
  "response_ref": {
    "case_id": "RO-FOUL-009",
    "subject_id": "gemini-3-1-flash-lite",
    "subject_version": "gemini-3.1-flash-lite",
    "run_id": "run-2026-05-12-001"
  },
  "criterion_scores": {
    "main_hypothesis": {
      "score": 2,
      "justification": "Anchor 'fouling orgánico + surfactantes + polímeros catiónicos' captura 2 de 3."
    },
    "key_signals": {
      "score": 1,
      "justification": "Signals listados."
    },
    "alternatives": {
      "score": 1,
      "justification": "2 alts breves."
    },
    "recommended_action": {
      "score": 1,
      "justification": "CIP alcalino + tensioactivo no iónico — sin coordinar fuente."
    },
    "requested_data": {
      "score": 2,
      "justification": "Pide FTIR depósito — match accepted."
    },
    "decision_change_condition": {
      "score": 1,
      "justification": "Trivial threshold FTIR inorgánica → switch."
    }
  },
  "correctness": 1,
  "automatic_fails_triggered": [],
  "reviewer_notes": ""
}
