{
  "evaluation_id": "eval-RO-FOUL-007-run-2026-05-08-001-R01",
  "benchmark_version": "v1.0",
  "scoring_timestamp_utc": "2026-05-13T10:38:10Z",
  "reviewer_id": "R01",
  "response_ref": {
    "case_id": "RO-FOUL-007",
    "subject_id": "claude-opus-4-6",
    "subject_version": "claude-opus-4-6",
    "run_id": "run-2026-05-08-001"
  },
  "criterion_scores": {
    "main_hypothesis": {
      "score": 2,
      "justification": "Anchor 'biofouling cabeza etapa 1 post-temporal + sobredosificación residual FeCl3' — match con dos hipótesis."
    },
    "key_signals": {
      "score": 2,
      "justification": "6 señales con relación: ATP×8, TOC×2, ΔP gradiente decreciente hacia cola."
    },
    "alternatives": {
      "score": 2,
      "justification": "3 alts (Fe coloidal, NOM, SCAL extremo) con why_discardable anclado."
    },
    "recommended_action": {
      "score": 2,
      "justification": "CIP NaOH+DBNPA+HCl si <80% + reducir FeCl3 a 0.8 + monitoreo ATP + DBNPA intermitente preventivo."
    },
    "requested_data": {
      "score": 2,
      "justification": "Pide autopsia LOI+Fe+ATP+microscopía — match autopsia FTIR/SEM-EDS/tinción del gold."
    },
    "decision_change_condition": {
      "score": 2,
      "justification": "Multi-umbral: Fe >30% w + ATP <1000 + LOI <25% → Fe coloidal con CIP ácido."
    }
  },
  "correctness": 1,
  "automatic_fails_triggered": [],
  "reviewer_notes": ""
}
