{
  "evaluation_id": "eval-RO-OXID-005-run-2026-05-13-001-R01",
  "benchmark_version": "v1.0",
  "scoring_timestamp_utc": "2026-05-13T18:38:53Z",
  "reviewer_id": "R01",
  "response_ref": {
    "case_id": "RO-OXID-005",
    "subject_id": "mistral-medium-3",
    "subject_version": "mistral-medium-2505",
    "run_id": "run-2026-05-13-001"
  },
  "criterion_scores": {
    "main_hypothesis": {
      "score": 2,
      "justification": "Anchor 'incomplete removal H2O2 post-CIP + residual oxidative damage' literal."
    },
    "key_signals": {
      "score": 1,
      "justification": "Signals brief."
    },
    "alternatives": {
      "score": 1,
      "justification": "2 alts brief."
    },
    "recommended_action": {
      "score": 2,
      "justification": "Take train offline + thorough rinse 120 min + residual H2O2 con método más sensible — match gold (méthod sensible >1 mg/L explícito)."
    },
    "requested_data": {
      "score": 2,
      "justification": "Pide exact residual H2O2 en permeato con método más sensible que 1 mg/L — match accepted (método más sensible)."
    },
    "decision_change_condition": {
      "score": 1,
      "justification": "Trivial: si <0.1 mg/L → invalidate hypothesis."
    }
  },
  "correctness": 1,
  "automatic_fails_triggered": [],
  "reviewer_notes": ""
}