{
  "evaluation_id": "eval-RO-FOUL-005-run-2026-05-12-001-R01",
  "benchmark_version": "v1.0",
  "scoring_timestamp_utc": "2026-05-13T10:38:10Z",
  "reviewer_id": "R01",
  "response_ref": {
    "case_id": "RO-FOUL-005",
    "subject_id": "gpt-3-5-turbo",
    "subject_version": "gpt-3.5-turbo-0125",
    "run_id": "run-2026-05-12-001"
  },
  "criterion_scores": {
    "main_hypothesis": {
      "score": 1,
      "justification": "MH 'Overdosing of FeCl3' — operacional cause; anchor 'carry-over' parcial."
    },
    "key_signals": {
      "score": 1,
      "justification": "Lista signals sin conexión."
    },
    "alternatives": {
      "score": 0,
      "justification": "Alts paráfrasis ('membrane fouling' is the MH)."
    },
    "recommended_action": {
      "score": 1,
      "justification": "'Adjust FeCl3 to 2.5 mg/L' — operacional sin CIP de membrana."
    },
    "requested_data": {
      "score": 0,
      "justification": "Pide 'Fe en permeado' — lugar incorrecto (no pasa membrana)."
    },
    "decision_change_condition": {
      "score": 1,
      "justification": "Trivial threshold."
    }
  },
  "correctness": 1,
  "automatic_fails_triggered": [],
  "reviewer_notes": ""
}
