{
  "evaluation_id": "eval-RO-FOUL-005-run-2026-05-12-001-R01",
  "benchmark_version": "v1.0",
  "scoring_timestamp_utc": "2026-05-13T10:38:10Z",
  "reviewer_id": "R01",
  "response_ref": {
    "case_id": "RO-FOUL-005",
    "subject_id": "gemini-2-5-flash-lite",
    "subject_version": "gemini-2.5-flash-lite",
    "run_id": "run-2026-05-12-001"
  },
  "criterion_scores": {
    "main_hypothesis": {
      "score": 2,
      "justification": "Anchor 'obstrucción por depósitos de óxido de hierro por sobredosis FeCl3'."
    },
    "key_signals": {
      "score": 1,
      "justification": "Signals listados sin conexión explícita."
    },
    "alternatives": {
      "score": 1,
      "justification": "3 alts breves."
    },
    "recommended_action": {
      "score": 2,
      "justification": "Detener + lavado cítrico/EDTA + reemplazar cartuchos + ajustar dosis — operacional + ácido."
    },
    "requested_data": {
      "score": 1,
      "justification": "Pide composición de depósitos — match parcial."
    },
    "decision_change_condition": {
      "score": 1,
      "justification": "Generic threshold."
    }
  },
  "correctness": 1,
  "automatic_fails_triggered": [],
  "reviewer_notes": ""
}
