{
  "evaluation_id": "eval-RO-MECH-002-run-2026-05-13-001-R01",
  "benchmark_version": "v1.0",
  "scoring_timestamp_utc": "2026-05-14T09:34:25Z",
  "reviewer_id": "R01",
  "response_ref": {
    "case_id": "RO-MECH-002",
    "subject_id": "gemini-3-1-flash-lite",
    "subject_version": "gemini-3.1-flash-lite",
    "run_id": "run-2026-05-13-001"
  },
  "criterion_scores": {
    "main_hypothesis": {
      "score": 2,
      "justification": "Anchor 'daño mecánico elemento líder telescoping + golpe ariete + VFD mal configurada' literal."
    },
    "key_signals": {
      "score": 1,
      "justification": "Signals brief."
    },
    "alternatives": {
      "score": 1,
      "justification": "2 alts brief (OXID, sellos)."
    },
    "recommended_action": {
      "score": 2,
      "justification": "Detener + reemplazar + reconfigurar VFD ≥120s — match operacional."
    },
    "requested_data": {
      "score": 2,
      "justification": "Pide tiempo rampa VFD configurado — match accepted."
    },
    "decision_change_condition": {
      "score": 1,
      "justification": "Single: probe test conductividad distribuida → degradación."
    }
  },
  "correctness": 1,
  "automatic_fails_triggered": [],
  "reviewer_notes": ""
}