{
  "evaluation_id": "eval-RO-MECH-003-run-2026-05-13-001-R01",
  "benchmark_version": "v1.0",
  "scoring_timestamp_utc": "2026-05-14T09:34:25Z",
  "reviewer_id": "R01",
  "response_ref": {
    "case_id": "RO-MECH-003",
    "subject_id": "gpt-5-5",
    "subject_version": "gpt-5.5-2026-04-23",
    "run_id": "run-2026-05-13-001"
  },
  "criterion_scores": {
    "main_hypothesis": {
      "score": 2,
      "justification": "Anchor 'fallo mecánico sello cabeza/cap final Tubo 2 + junta tórica dañada o mal asentada + cap con protrusión' literal."
    },
    "key_signals": {
      "score": 2,
      "justification": "Conecta evidencia."
    },
    "alternatives": {
      "score": 2,
      "justification": "5 alts (interconector, OXID, scaling, daño estructural FRP)."
    },
    "recommended_action": {
      "score": 2,
      "justification": "Retirar Tubo 2 + LOTO + reemplazar junta tórica + cap OEM + lubricante + par apriete — match gold."
    },
    "requested_data": {
      "score": 1,
      "justification": "Pide caída presión hidrostática con cap nuevo OEM 1 bar — match accepted."
    },
    "decision_change_condition": {
      "score": 1,
      "justification": "Multi: cap nuevo sigue perdiendo presión → FRP daño switch."
    }
  },
  "correctness": 1,
  "automatic_fails_triggered": [],
  "reviewer_notes": ""
}