{
  "evaluation_id": "eval-RO-OXID-005-run-2026-05-13-001-R01",
  "benchmark_version": "v1.0",
  "scoring_timestamp_utc": "2026-05-13T18:38:53Z",
  "reviewer_id": "R01",
  "response_ref": {
    "case_id": "RO-OXID-005",
    "subject_id": "gemini-2-5-pro",
    "subject_version": "gemini-2.5-pro",
    "run_id": "run-2026-05-13-001"
  },
  "criterion_scores": {
    "main_hypothesis": {
      "score": 2,
      "justification": "Anchor 'daño oxidativo irreversible T-03 por H2O2 residual + enjuague insuficiente' literal."
    },
    "key_signals": {
      "score": 1,
      "justification": "Signals brief."
    },
    "alternatives": {
      "score": 1,
      "justification": "3 alts brief (MECH O-ring, biofouling, precipitación)."
    },
    "recommended_action": {
      "score": 2,
      "justification": "Aislar T-03 + enjuague exhaustivo 90 min + verificar H2O2 colorimétrico alta sensibilidad <0.1 (no tira) — match gold explícito."
    },
    "requested_data": {
      "score": 2,
      "justification": "Pide perfil conductividad permeato por vasos individuales — match accepted."
    },
    "decision_change_condition": {
      "score": 2,
      "justification": "Multi: aumento conductividad localizado en único vaso (cola) → MECH switch."
    }
  },
  "correctness": 1,
  "automatic_fails_triggered": [],
  "reviewer_notes": ""
}