{
  "evaluation_id": "eval-RO-OXID-002-run-2026-05-13-001-R01",
  "benchmark_version": "v1.0",
  "scoring_timestamp_utc": "2026-05-13T18:38:53Z",
  "reviewer_id": "R01",
  "response_ref": {
    "case_id": "RO-OXID-002",
    "subject_id": "deepseek-v4-flash",
    "subject_version": "deepseek-v4-flash",
    "run_id": "run-2026-05-13-001"
  },
  "criterion_scores": {
    "main_hypothesis": {
      "score": 2,
      "justification": "Anchor 'oxidation damage por ozono residual + ausencia bisulfite' literal."
    },
    "key_signals": {
      "score": 2,
      "justification": "Conecta evidencia."
    },
    "alternatives": {
      "score": 2,
      "justification": "3 alts (envejecimiento, MECH O-ring, scaling) con why_discardable."
    },
    "recommended_action": {
      "score": 2,
      "justification": "SBS 0.3 mg/L (factor seguridad 5x) + ORP <150 + ajustar + coordinar — match gold."
    },
    "requested_data": {
      "score": 2,
      "justification": "Pide perfil conductividad permeato por tubo — match accepted."
    },
    "decision_change_condition": {
      "score": 2,
      "justification": "Multi: perfil no uniforme + SBS reduce ORP pero conductividad sigue → MECH."
    }
  },
  "correctness": 1,
  "automatic_fails_triggered": [],
  "reviewer_notes": ""
}